{
  "$schema": "../../template.schema.json",
  "name": "Web app",
  "description": "Single-page app",
  "category": "apps",
  "framework": "vite",
  "framework_label": "Vite + React",
  "workload": {
    "type": "static",
    "output_directory": "dist",
    "spa_fallback": true
  },
  "order": 10,
  "optional_env": [
    {
      "key": "SITE_URL",
      "hint": "The site's full address, for link previews: https://…"
    }
  ]
}
